bulbasaur,1,Grass,Poison,318,45,49,49,65,65,45,monster,grass,16,overgrow,chlorophyll,medium slow,31,0,,ivysaur,"While it is young, it uses the nutrients that are stored in the seed on its back in order to grow."
ivysaur,2,Grass,Poison,405,60,62,63,80,80,60,monster,grass,32,overgrow,chlorophyll,medium slow,31,0,bulbasaur,ivysaur,Exposure to sunlight adds to its strength. Sunlight also makes the bud on its back grow larger.
venusaur,3,Grass,Poison,525,80,82,83,100,100,80,monster,grass,,overgrow,chlorophyll,medium slow,31,0,ivysaur,ivysaur,Huge amounts of pollen burst from it with the force of a volcanic eruption. Breathing in too much of the pollen can cause fainting.
charmander,4,Fire,,309,39,52,43,60,50,65,monster,dragon,16,blaze,solar power,medium slow,31,0,,charmeleon,"From the time it is born, a flame burns at the tip of its tail. Its life would end if the flame were to go out."
charmeleon,5,Fire,,405,58,64,58,80,65,80,monster,dragon,36,blaze,solar power,medium slow,31,0,charmander,charmeleon,"If it becomes agitated during battle, it spouts intense flames, incinerating its surroundings."
charizard,6,Fire,Flying,534,78,84,78,109,85,100,monster,dragon,,blaze,solar power,medium slow,31,0,charmeleon,charmeleon,"The flame inside its body burns hotter than 3,600 degrees Fahrenheit. When Charizard roars, that temperature climbs even higher."
squirtle,7,Water,,314,44,48,65,50,64,43,monster,water 1,16,torrent,rain dish,medium slow,31,0,,wartortle,"When it feels threatened, it draws its limbs inside its shell and sprays water from its mouth."
wartortle,8,Water,,405,59,63,80,65,80,58,monster,water 1,36,torrent,rain dish,medium slow,31,0,squirtle,wartortle,It cleverly controls its furry ears and tail to maintain its balance while swimming.
blastoise,9,Water,,530,79,83,100,85,105,78,monster,water 1,,torrent,rain dish,medium slow,31,0,wartortle,wartortle,Water fired from this Pokemon’s central main cannon has enough power to blast a hole into a mountain.
caterpie,10,Bug,,195,45,30,35,20,20,45,bug,,7,shield dust,run away,medium fast,127,0,,metapod,Its short feet are tipped with suction pads that enable it to tirelessly climb slopes and walls.
metapod,11,Bug,,205,50,20,55,25,25,30,bug,,10,shed skin,,medium fast,127,0,caterpie,metapod,"Even though it is encased in a sturdy shell, the body inside is tender. It can’t withstand a harsh attack."
butterfree,12,Bug,Flying,395,60,45,50,90,80,70,bug,,,compound eyes,tinted lens,medium fast,127,0,metapod,metapod,"Once it has opponents trapped in a tornado that could blow away a 10-ton truck, it finishes them off with its poisonous scales."
weedle,13,Bug,Poison,195,40,35,30,20,20,50,bug,,7,shield dust,run away,medium fast,127,0,,kakuna,Beware of the sharp stinger on its head. It hides in grass and bushes where it eats leaves.
kakuna,14,Bug,Poison,205,45,25,50,25,25,35,bug,,10,shed skin,,medium fast,127,0,weedle,kakuna,"Able to move only slightly. When endangered, it may stick out its stinger and poison its enemy."
beedrill,15,Bug,Poison,395,65,90,40,45,80,75,bug,,,swarm,sniper,medium fast,127,0,kakuna,kakuna,"Its legs have become poison stingers. It stabs its prey repeatedly with the stingers on its limbs, dealing the final blow with the stinger on its rear."
pidgey,16,Normal,Flying,251,40,45,40,35,35,56,flying,,18,keen eye,big pecks,medium slow,127,0,,pidgeotto,"Very docile. If attacked, it will often kick up sand to protect itself rather than fight back."
pidgeotto,17,Normal,Flying,349,63,60,55,50,50,71,flying,,36,keen eye,big pecks,medium slow,127,0,pidgey,pidgeotto,This Pokemon is full of vitality. It constantly flies around its large territory in search of prey.
pidgeot,18,Normal,Flying,479,83,80,75,70,70,101,flying,,,keen eye,big pecks,medium slow,127,0,pidgeotto,pidgeotto,"With its muscular strength now greatly increased, it can fly continuously for two weeks without resting."
rattata,19,Normal,,253,30,56,35,25,35,72,field,,20,run away,hustle,medium fast,127,0,,raticate,"Will chew on anything with its fangs. If you see one, you can be certain that 40 more live in the area."
raticate,20,Normal,,413,55,81,60,50,70,97,field,,,run away,hustle,medium fast,127,0,rattata,raticate,"Its hind feet are webbed. They act as flippers, so it can swim in rivers and hunt for prey."
spearow,21,Normal,Flying,262,40,60,30,31,31,70,flying,,20,keen eye,sniper,medium fast,127,0,,fearow,"Inept at flying high. However, it can fly around very fast to protect its territory."
fearow,22,Normal,Flying,442,65,90,65,61,61,100,flying,,,keen eye,sniper,medium fast,127,0,spearow,fearow,"A Pokemon that dates back many years. If it senses danger, it flies high and away, instantly."
ekans,23,Poison,,288,35,60,44,40,54,55,field,dragon,22,intimidate,unnerve,medium fast,127,0,,arbok,"The older it gets, the longer it grows. At night, it wraps its long body around tree branches to rest."
arbok,24,Poison,,448,60,95,69,65,79,80,field,dragon,,intimidate,unnerve,medium fast,127,0,ekans,arbok,The frightening patterns on its belly have been studied. Six variations have been confirmed.
pikachu,25,Electric,,320,35,55,40,50,50,90,field,fairy,,static,lightning rod,medium fast,127,0,pichu,pikachu,"When it smashes its opponents with its bolt- shaped tail, it delivers a surge of electricity equivalent to a lightning strike."
raichu,26,Electric,,485,60,90,55,90,80,110,field,fairy,,static,lightning rod,medium fast,254,0,pikachu,pikachu,This Pokemon rides on its tail while it uses its psychic powers to levitate. It attacks with star-shaped thunderbolts.
sandshrew,27,Ground,,300,50,75,85,20,30,40,field,,22,sand veil,sand rush,medium fast,127,0,,sandslash,"It lives in snowy mountains on southern islands. When a blizzard rolls in, this Pokemon hunkers down in the snow to avoid getting blown away."
sandslash,28,Ground,,450,75,100,110,45,55,65,field,,,sand veil,sand rush,medium fast,127,0,sandshrew,sandslash,"Many people climb snowy mountains, hoping to see the icy spikes of these Pokemon glistening in the light of dawn."
nidoran-f,29,Poison,,275,55,47,52,40,40,41,monster,field,16,poison point,hustle,medium slow,127,0,,nidorina,A mild-mannered Pokemon that does not like to fight. Beware—its small horn secretes venom.
nidorina,30,Poison,,365,70,62,67,55,55,56,undiscovered,,,poison point,hustle,medium slow,254,0,nidoran-f,nidorina,"When resting deep in its burrow, its barbs always retract. This is proof that it is relaxed."
nidoqueen,31,Poison,Ground,505,90,92,87,75,85,76,undiscovered,,,poison point,sheer force,medium slow,254,0,nidorina,nidorina,Tough scales cover the sturdy body of this Pokemon. It appears that the scales grow in cycles.
nidoran-m,32,Poison,,273,46,57,40,40,40,50,monster,field,16,poison point,hustle,medium slow,254,0,,nidorino,"Its large ears are always kept upright. If it senses danger, it will attack with a poisonous sting."
nidorino,33,Poison,,365,61,72,57,55,55,65,monster,field,,poison point,hustle,medium slow,0,0,nidoran-m,nidorino,"Its horn contains venom. If it stabs an enemy with the horn, the impact makes the poison leak out."
nidoking,34,Poison,Ground,505,81,102,77,85,75,85,monster,field,,poison point,sheer force,medium slow,0,0,nidorino,nidorino,"Its steel-like hide adds to its powerful tackle. Its horns are so hard, they can pierce a diamond."
clefairy,35,Fairy,,323,70,45,48,60,65,35,fairy,,,cute charm,friend guard,fast,0,0,cleffa,clefairy,"Its adorable behavior and cry make it highly popular. However, this cute Pokemon is rarely found."
clefable,36,Fairy,,483,95,70,73,95,90,60,fairy,,,cute charm,unaware,fast,191,0,clefairy,clefairy,"Their ears are sensitive enough to hear a pin drop from over a mile away, so they’re usually found in quiet places."
vulpix,37,Fire,,299,38,41,40,50,65,65,field,,,flash fire,drought,medium fast,191,0,,ninetales,"If you observe its curly hairs through a microscope, you’ll see small ice particles springing up."
ninetales,38,Fire,,505,73,76,75,81,100,100,field,,,flash fire,drought,medium fast,191,0,vulpix,ninetales,"While it will guide travelers who get lost on a snowy mountain down to the mountain’s base, it won’t forgive anyone who harms nature."
Jigglypuff,39,Normal,Fairy,270,115,45,20,45,25,20,fairy,,,cute charm,friend guard,fast,191,0,igglybuff,jigglypuff,"By freely changing the wavelength of its voice, Jigglypuff sings a mysterious melody sure to make any listener sleepy."
wigglytuff,40,Normal,Fairy,435,140,70,45,85,50,45,fairy,,,cute charm,frisk,fast,191,0,jigglypuff,jigglypuff,"It’s proud of its fur, which is fine and delicate. In particular, the curl on its forehead has a texture that’s perfectly heavenly."
zubat,41,Poison,Flying,245,40,45,35,30,40,55,flying,,22,inner focus,infiltrator,medium fast,191,0,,golbat,Emits ultrasonic cries while it flies. They act as a sonar used to check for objects in its way.
golbat,42,Poison,Flying,455,75,80,70,65,75,90,flying,,,inner focus,infiltrator,medium fast,127,0,zubat,golbat,"It attacks in a stealthy manner, without warning. Its sharp fangs are used to bite and to suck blood."
oddish,43,Grass,Poison,320,45,50,55,75,65,30,grass,,21,chlorophyll,run away,medium slow,127,0,,gloom,"During the day, it stays in the cold underground to avoid the sun. It grows by bathing in moonlight."
gloom,44,Grass,Poison,395,60,65,70,85,75,40,grass,,,chlorophyll,stench,medium slow,127,0,oddish,gloom,What appears to be drool is actually sweet honey. It is very sticky and clings stubbornly if touched.
vileplume,45,Grass,Poison,490,75,80,85,110,90,50,grass,,,chlorophyll,effect spore,medium slow,127,0,gloom,gloom,"The larger its petals, the more toxic pollen it contains. Its big head is heavy and hard to hold up."
paras,46,Bug,Grass,285,35,70,55,45,55,25,bug,grass,24,effect spore,damp,medium fast,127,0,,parasect,Burrows under the ground to gnaw on tree roots. The mushrooms on its back absorb most of the nutrition.
parasect,47,Bug,Grass,405,60,95,80,60,80,30,bug,grass,,effect spore,damp,medium fast,127,0,paras,parasect,The bug host is drained of energy by the mushroom on its back. The mushroom appears to do all the thinking.
venonat,48,Bug,Poison,305,60,55,50,40,55,45,bug,,31,compound eyes,run away,medium fast,127,0,,venomoth,"Its large eyes act as radar. In a bright place, you can see that they are clusters of many tiny eyes."
venomoth,49,Bug,Poison,450,70,65,60,90,75,90,bug,,,shield dust,wonder skin,medium fast,127,0,venonat,venomoth,The powdery scales on its wings are hard to remove from skin. They also contain poison that leaks out on contact.
diglett,50,Ground,,265,10,55,25,35,45,95,field,,26,sand veil,sand force,medium fast,127,0,,dugtrio,Its three hairs change shape depending on Diglett’s mood. They’re a useful communication tool among these Pokemon.
dugtrio,51,Ground,,425,35,100,50,50,70,120,field,,,sand veil,sand force,medium fast,127,0,diglett,dugtrio,These Diglett triplets dig over 60 miles below sea level. No one knows what it’s like underground.
meowth,52,Normal,,290,40,45,35,40,40,90,field,,28,pickup,unnerve,medium fast,127,0,,persian,"These daring Pokemon have coins on their foreheads. Darker coins are harder, and harder coins garner more respect among Meowth."
persian,53,Normal,,440,65,70,60,65,65,115,field,,,limber,unnerve,medium fast,127,0,meowth,persian,"This Pokemon is one tough opponent. Not only does it have formidable physical abilities, but it’s also not above fighting dirty."
psyduck,54,Water,,320,50,52,48,65,50,55,water 1,field,33,damp,swift swim,medium fast,127,0,,golduck,"As Psyduck gets stressed out, its headache gets progressively worse. It uses intense psychic energy to overwhelm those around it."
golduck,55,Water,,500,80,82,78,95,80,85,water 1,field,,damp,swift swim,medium fast,127,0,psyduck,golduck,Old tales tell of Golduck punishing those that defiled its river. The guilty were dragged into the water and taken away.
mankey,56,Fighting,,305,40,80,35,35,45,70,field,,28,vital spirit,defiant,medium fast,127,0,,primeape,An agile Pokemon that lives in trees. It angers easily and will not hesitate to attack anything.
primeape,57,Fighting,,455,65,105,60,60,70,95,field,,,vital spirit,defiant,medium fast,127,0,mankey,primeape,It stops being angry only when nobody else is around. To view this moment is very difficult.
growlithe,58,Fire,,350,55,70,45,70,50,60,field,,,intimidate,justified,slow,127,0,,arcanine,"Extremely loyal, it will fearlessly bark at any opponent to protect its own Trainer from harm."
arcanine,59,Fire,,555,90,110,80,100,80,95,field,,,intimidate,justified,slow,63,0,growlithe,arcanine,A Pokemon that has long been admired for its beauty. It runs agilely as if on wings.
poliwag,60,Water,,300,40,50,40,40,40,90,water 1,,25,water absorb,swift swim,medium slow,63,0,,poliwhirl,"In rivers with fast-flowing water, this Pokemon will cling to a rock by using its thick lips, which act like a suction cup."
poliwhirl,61,Water,,385,65,65,65,50,50,90,water 1,,,water absorb,swift swim,medium slow,127,0,poliwag,poliwhirl,"This Pokemon’s sweat is a slimy mucus. When captured, Poliwhirl can slither from its enemies’ grasp and escape."
poliwrath,62,Water,Fighting,510,90,95,95,70,90,70,water 1,,,water absorb,swift swim,medium slow,127,0,poliwhirl,poliwhirl,Poliwrath is skilled at both swimming and martial arts. It uses its well-trained arms to dish out powerful punches.
abra,63,Psychic,,310,25,20,15,105,55,90,human-like,,16,synchronize,magic guard,medium slow,127,0,,kadabra,"Abra can teleport in its sleep. Apparently the more deeply Abra sleeps, the farther its teleportations go."
kadabra,64,Psychic,,400,40,35,30,120,70,105,human-like,,,synchronize,magic guard,medium slow,63,0,abra,kadabra,"This Pokemon’s telekinesis is immensely powerful. To prepare for evolution, Kadabra stores up psychic energy in the star on its forehead."
alakazam,65,Psychic,,500,55,50,45,135,95,120,human-like,,,synchronize,magic guard,medium slow,63,0,kadabra,kadabra,Alakazam wields potent psychic powers. It’s said that this Pokemon used these powers to create the spoons it holds.
machop,66,Fighting,,305,70,80,50,35,35,35,human-like,,28,guts,steadfast,medium slow,63,0,,machoke,"Always brimming with power, it passes time by lifting boulders. Doing so makes it even stronger."
machoke,67,Fighting,,405,80,100,70,50,60,45,human-like,,,guts,steadfast,medium slow,63,0,machop,machoke,Its formidable body never gets tired. It helps people by doing work such as the moving of heavy goods.
machamp,68,Fighting,,505,90,130,80,65,85,55,human-like,,,guts,steadfast,medium slow,63,0,machoke,machoke,"With four arms that react more quickly than it can think, it can execute many punches at once."
bellsprout,69,Grass,Poison,300,50,75,35,70,30,40,grass,,21,chlorophyll,gluttony,medium slow,63,0,,weepinbell,Prefers hot and humid places. It ensnares tiny bugs with its vines and devours them.
weepinbell,70,Grass,Poison,390,65,90,50,85,45,55,grass,,,chlorophyll,gluttony,medium slow,127,0,bellsprout,weepinbell,"When hungry, it swallows anything that moves. Its hapless prey is dissolved by strong acids."
victreebel,71,Grass,Poison,490,80,105,65,100,70,70,grass,,,chlorophyll,gluttony,medium slow,127,0,weepinbell,weepinbell,"Lures prey with the sweet aroma of honey. Swallowed whole, the prey is dissolved in a day, bones and all."
tentacool,72,Water,Poison,335,40,40,35,50,100,70,water 3,,30,clear body,rain dish,slow,127,0,,tentacruel,"This Pokemon is mostly made of water. A Tentacool out in the ocean is very hard to spot, because its body blends in with the sea."
tentacruel,73,Water,Poison,515,80,70,65,80,120,100,water 3,,,clear body,rain dish,slow,127,0,tentacool,tentacruel,"Its 80 tentacles can stretch and shrink freely. Tentacruel ensnares prey in a net of spread-out tentacles, delivering venomous stings to its catch."
geodude,74,Rock,Ground,300,40,80,100,30,30,20,mineral,,25,rock head,sand veil,medium slow,127,0,,graveler,"Its stone head is imbued with electricity and magnetism. If you carelessly step on one, you’ll be in for a painful shock."
graveler,75,Rock,Ground,390,55,95,115,45,45,35,mineral,,,rock head,sand veil,medium slow,127,0,geodude,graveler,"When it comes rolling down a mountain path, anything in its way gets zapped by electricity and sent flying."
golem,76,Rock,Ground,495,80,120,130,55,65,45,mineral,,,rock head,sand veil,medium slow,127,0,graveler,graveler,"Once it sheds its skin, its body turns tender and whitish. Its hide hardens when it’s exposed to air."
ponyta,77,Fire,,410,50,85,55,65,65,90,field,,40,run away,flame body,medium fast,127,0,,rapidash,"This Pokemon will look into your eyes and read the contents of your heart. If it finds evil there, it promptly hides away."
rapidash,78,Fire,,500,65,100,70,80,80,105,field,,,run away,flame body,medium fast,127,0,ponyta,rapidash,"The fastest runner becomes the leader, and it decides the herd’s pace and direction of travel."
slowpoke,79,Water,Psychic,315,90,65,65,40,40,15,monster,water 1,37,oblivious,regenerator,medium fast,127,0,,slowking,"When this Pokemon’s tail is soaked in water, sweetness seeps from it. Slowpoke uses this trait to lure in and fish up other Pokemon."
slowbro,80,Water,Psychic,490,95,75,110,100,80,30,monster,water 1,,oblivious,regenerator,medium fast,127,0,slowpoke,slowking,"If this Pokemon squeezes the tongue of the Shellder biting it, the Shellder will launch a toxic liquid from the tip of its shell."
magnemite,81,Electric,Steel,325,25,35,70,95,55,45,mineral,,30,magnet pull,analytic,medium fast,127,0,,magneton,"It subsists on electricity. As Magnemite flies, it emits electromagnetic waves from the units on each side of its body."
magneton,82,Electric,Steel,465,50,60,95,120,70,70,mineral,,,magnet pull,analytic,medium fast,255,0,magnemite,magneton,This Pokemon is constantly putting out a powerful magnetic force. Most computers go haywire when a Magneton approaches.
farfetch'd,83,Normal,Flying,377,52,90,55,58,62,60,flying,field,,keen eye,defiant,medium fast,255,0,,,"They use a plant stalk as a weapon, but not all of them use it in the same way. Several distinct styles of stalk fighting have been observed."
doduo,84,Normal,Flying,310,35,85,45,35,35,75,flying,,31,run away,tangled feet,medium fast,127,0,,dodrio,"Its short wings make flying difficult. Instead, this Pokemon runs at high speed on developed legs."
dodrio,85,Normal,Flying,470,60,110,70,60,60,110,flying,,,run away,tangled feet,medium fast,127,0,doduo,dodrio,One of Doduo’s two heads splits to form a unique species. It runs close to 40 mph in prairies.
seel,86,Water,,325,65,45,55,45,70,45,water 1,field,34,thick fat,ice body,medium fast,127,0,,dewgong,Loves freezing-cold conditions. Relishes swimming in a frigid climate of around 14 degrees Fahrenheit.
dewgong,87,Water,Ice,475,90,70,80,70,95,70,water 1,field,,thick fat,ice body,medium fast,127,0,seel,dewgong,"Its entire body is a snowy white. Unharmed by even intense cold, it swims powerfully in icy waters."
grimer,88,Poison,,325,80,80,50,40,50,25,amorphous,,38,stench,poison touch,medium fast,127,0,,muk,Made of congealed sludge. It smells too putrid to touch. Even weeds won’t grow in its path.
muk,89,Poison,,500,105,105,75,65,100,50,amorphous,,,stench,poison touch,medium fast,127,0,grimer,muk,"Smells so awful, it can cause fainting. Through degeneration of its nose, it lost its sense of smell."
shellder,90,Water,,305,30,65,100,45,25,40,water 3,,,shell armor,overcoat,slow,127,0,,cloyster,Its hard shell repels any kind of attack. It is vulnerable only when its shell is open.
cloyster,91,Water,Ice,525,50,95,180,85,45,70,water 3,,,shell armor,overcoat,slow,127,0,shellder,cloyster,"Once it slams its shell shut, it is impossible to open, even by those with superior strength."
gastly,92,Ghost,Poison,310,30,35,30,100,35,80,amorphous,,25,levitate,,medium slow,127,0,,haunter,"With its gas-like body, it can sneak into any place it desires. However, it can be blown away by wind."
haunter,93,Ghost,Poison,405,45,50,45,115,55,95,amorphous,,,levitate,,medium slow,127,0,gastly,haunter,"If you get the feeling of being watched in darkness when nobody is around, Haunter is there."
gengar,94,Ghost,Poison,500,60,65,60,130,75,110,amorphous,,,cursed body,,medium slow,127,0,haunter,haunter,"It lays traps, hoping to steal the lives of those it catches. If you stand in front of its mouth, you’ll hear your loved ones’ voices calling out to you."
onix,95,Rock,Ground,385,35,45,160,30,45,70,mineral,,,rock head,weak armor,medium fast,127,0,,steelix,"It rapidly bores through the ground at 50 mph by squirming and twisting its massive, rugged body."
drowzee,96,Psychic,,328,60,48,45,43,90,42,human-like,,26,insomnia,inner focus,medium fast,127,0,,hypno,"If you sleep by it all the time, it will sometimes show you dreams it had eaten in the past."
hypno,97,Psychic,,483,85,73,70,73,115,67,human-like,,,insomnia,inner focus,medium fast,127,0,drowzee,hypno,Avoid eye contact if you come across one. It will try to put you to sleep by using its pendulum.
krabby,98,Water,,325,30,105,90,25,25,50,water 3,,28,hyper cutter,sheer force,medium fast,127,0,,kingler,"If it senses danger approaching, it cloaks itself with bubbles from its mouth so it will look bigger."
kingler,99,Water,,475,55,130,115,50,50,75,water 3,,,hyper cutter,sheer force,medium fast,127,0,krabby,kingler,The bubbles it spews out are strongly alkaline. Any opponents hit by them will have their bodies quickly melted away.
voltorb,100,Electric,,330,40,30,50,55,55,100,mineral,,30,soundproof,aftermath,medium fast,127,0,,electrode,It is said to camouflage itself as a Poke Ball. It will self-destruct with very little stimulus.
electrode,101,Electric,,490,60,50,70,80,80,150,mineral,,,soundproof,aftermath,medium fast,255,0,voltorb,electrode,Stores electrical energy inside its body. Even the slightest shock could trigger a huge explosion.
exeggcute,102,Grass,Psychic,325,60,40,80,60,45,40,grass,,,chlorophyll,harvest,slow,255,0,,exeggutor,"These Pokemon get nervous when they’re not in a group of six. The minute even one member of the group goes missing, Exeggcute become cowardly."
exeggutor,103,Grass,Psychic,530,95,95,85,125,75,55,grass,,,chlorophyll,harvest,slow,127,0,exeggcute,exeggutor,"When they work together, Exeggutor’s three heads can put out powerful psychic energy. Cloudy days make this Pokemon sluggish."
cubone,104,Ground,,320,50,50,95,40,50,35,monster,,28,rock head,battle armor,medium fast,127,0,,marowak,"This Pokemon wears the skull of its deceased mother. Sometimes Cubone’s dreams make it cry, but each tear Cubone sheds makes it stronger."
marowak,105,Ground,,425,60,80,110,50,80,45,monster,,,rock head,battle armor,medium fast,127,0,cubone,marowak,"When this Pokemon evolved, the skull of its mother fused to it. Marowak’s temperament also turned vicious at the same time."
hitmonlee,106,Fighting,,455,50,120,53,35,110,87,human-like,,,limber,unburden,medium fast,127,0,tyrogue,hitmontop,The legs freely contract and stretch. The stretchy legs allow it to hit a distant foe with a rising kick.
hitmonchan,107,Fighting,,455,50,105,79,35,110,76,human-like,,,keen eye,inner focus,medium fast,0,0,tyrogue,hitmontop,"Its punches slice the air. However, it seems to need a short break after fighting for three minutes."
lickitung,108,Normal,,385,90,55,75,60,75,30,monster,,,own tempo,cloud nine,medium fast,0,0,,lickilicky,"Bug Pokemon are Lickitung’s main food source. This Pokemon paralyzes its prey with a lick from its long tongue, then swallows the prey whole."
koffing,109,Poison,,340,40,65,95,60,45,35,amorphous,,20,levitate,stench*,medium fast,127,0,,weezing,It adores polluted air. Some claim that Koffing used to be more plentiful in the Galar region than they are now.
weezing,110,Poison,,490,65,90,120,85,70,60,amorphous,,,levitate,stench*,medium fast,127,0,koffing,weezing,"Long ago, during a time when droves of factories fouled the air with pollution, Weezing changed into this form for some reason."
rhyhorn,111,Ground,Rock,345,80,85,95,30,30,25,monster,field,35,lightning rod,reckless,slow,127,0,,rhydon,"It can remember only one thing at a time. Once it starts rushing, it forgets why it started."
rhydon,112,Ground,Rock,485,105,130,120,45,45,40,monster,field,,lightning rod,reckless,slow,127,0,rhyhorn,rhydon,"Protected by an armor-like hide, it is capable of living in molten lava of 3,600 degrees Fahrenheit."
chansey,113,Normal,,450,250,5,5,35,105,50,fairy,,,natural cure,healer,fast,127,0,happiny,chansey,"This species was once very slow. To protect their eggs from other creatures, these Pokemon became able to flee quickly."
tangela,114,Grass,,435,65,55,115,100,40,60,grass,,,chlorophyll,regenerator,medium fast,254,0,,tangrowth,"The vines of a Tangela have a distinct scent. In some parts of Galar, Tangela vines are used as herbs."
kangaskhan,115,Normal,,490,105,95,80,40,80,90,monster,,,early bird,inner focus,medium fast,127,0,,,There are records of a lost human child being raised by a childless Kangaskhan.
horsea,116,Water,,295,30,40,70,70,25,60,water 1,dragon,42,swift swim,damp,medium fast,254,0,,seadra,They swim with dance-like motions and cause whirlpools to form. Horsea compete to see which of them can generate the biggest whirlpool.
seadra,117,Water,,440,55,65,95,95,45,85,water 1,dragon,,poison point,damp,medium fast,127,0,horsea,seadra,"Seadra’s mouth is slender, but its suction power is strong. In an instant, Seadra can suck in food that’s larger than the opening of its mouth."
goldeen,118,Water,,320,45,67,60,35,50,63,water 2,,32,swift swim,lightning rod,medium fast,127,0,,seaking,Its dorsal and pectoral fins are strongly developed like muscles. It can swim at a speed of five knots.
seaking,119,Water,,450,80,92,65,65,80,68,water 2,,,swift swim,lightning rod,medium fast,127,0,goldeen,seaking,"Using its horn, it bores holes in riverbed boulders, making nests to prevent its eggs from washing away."
